{"max_terms":2,"n":8,"producer":{"method":"exact_profile_dp","purpose":"counterexample to descending greedy optimality","result_class":"finite certificate"},"schema":"erdos18.factorial.representation.v1","target":155,"target_range":{"lower":0,"upper_exclusive":201},"terms":[{"label":"d0","value":15},{"label":"d1","value":140}]}
