{"max_terms":3,"n":13,"producer":{"method":"exact_profile_dp","result_class":"finite certificate"},"schema":"erdos18.factorial.representation.v1","target":1559,"target_range":{"lower":0,"upper_exclusive":78912},"terms":[{"label":"d0","value":1},{"label":"d1","value":18},{"label":"d2","value":1540}]}
